时间,评论,是否与股票相关,评论类型,测试
Wed May 19 07:09:44 CST 2021,西格尔教授在《投资者的未来》中说：“股票的长期收益，并不依赖于实际的利润增长情况，而是取决于实际的利润增长与投资者预期的利润增长之间存在的差异。”所以，投资一家公司，核心是：这家公司的业绩，要比市场预期更好。这段话价值百万！比如说“绝味食品”“爱尔眼科”就是不断的超预期！,待标注,积极,测试A
Tue May 18 12:59:29 CST 2021,这几天一句话看似真理的话很是盛行，200亿市值以下的公司不能买。纯属无稽之谈 这才多少亿市值，几十亿市值不买，难道上了200多亿再追着买？ 150亿市值时不买，这下好了，涨到500多亿市值了还是好好的研究公司吧，大市值公司也是从小市值涨起来的,与股票相关,积极,测试A
Tue May 18 10:58:27 CST 2021,绝味食品，泰格医药，药明康德，安图生物。新产业，逢低吸,与股票相关,中性,测试A
Tue May 18 09:23:52 CST 2021,绝味食品今天要创反弹以来的收盘最高价，68一路上来！并再次形成买点。,与股票相关,积极,测试A
